{"binding_context_ref":{"artifact_path":"valid/binding-context-m5.json","artifact_sha256":"d2518dd381d442c76be6af66291c310d7130ebe4e39b92584416e0a758d457aa","context_id":"fixture-binding-context-m5"},"boundary_id":"ylx-transfer","component_artifact_identity":"artifact-ylx-transfer","component_artifact_owner":"owner-ylx-transfer","component_artifact_sha256":"36982fead20724dd0a47e17e8c89251de941938470a23013eff5d04ce7b466f9","component_maintainer_subrole":"maintainer-ylx-transfer","deployed_environment_identity":"environment-ylx-transfer","deployment_record_sha256":"7dd7f1d6e1824837eddd5ddd36bb61018721b3330e2b656ae115a827e7f45999","execution_context_refs":[{"artifact_path":"valid/execution-context-consumers.json","artifact_sha256":"e8d4a9b3cdf8bfd1b02e23f9309eb08595ab625da7514a2818403a719704df75","context_id":"fixture-consumer-execution-context"}],"key_validity_revocation_head_sha256":"6fa9102b8171a57d0ae8179ad039e5ceb1fa81187b0b4e196989916ff834758f","role_assignment_artifact_sha256":"e1c270ac996d7bab5f8122b88ba807f0bf50f7e27666bfb8c154b066d699f0e8","role_assignment_revision":1,"schema":"ylx.component-maintainer-attestation.v1","signed_at":"2026-06-01T12:00:00Z","signer_identity":{"identity_authority_ref":{"artifact_path":"contracts/fixtures/governance-models/support/fixture-identity-authority-r1.json","artifact_sha256":"a91d83665e6e681cb7705e276f2af94d6903604f1ae661de978070a30be72659","authority_id":"fixture-identity-authority","revision":1,"verified_at":"2026-06-01T12:00:00Z"},"natural_person_identity_sha256":"8f1f348df91ab653fec1cc248c961ec91bd3997a6d25643c8ffc09af119ca032","person_id":"fixture-maintainer-person-ylx-transfer"},"signing_key_fingerprint":"8a636760aebb400ad54df00f11c9bef1e9984aee5bc1745e7c7546654a70fe88","signing_policy_sha256":"13c69df1431b8c499aac013b5f39ff673207a11eea267c920e81a976a03ab39c"}